{
    "last_run": "2026-10-12T09:59:41Z",
    "target_commit": "89abcde0123f456789abcde0123f456789abcde0",
    "installed_commit": "0123abc4567def890123abc4567def890123abc4",
    "result": "blocked",
    "_result_values": "deployed | skipped | blocked | failed",
    "gate": "job test concluded: in_progress",
    "failed_step": "",
    "failed_attempts": 0
}
