{
    "last_run": "2026-10-12T09:29:45Z",
    "target_tag": "2.3.1",
    "installed_tag": "2.3.1",
    "target_commit": "0123abc4567def890123abc4567def890123abc4",
    "installed_commit": "0123abc4567def890123abc4567def890123abc4",
    "result": "deployed",
    "_result_values": "deployed | skipped | blocked | failed",
    "gate": "ok",
    "failed_step": "",
    "failed_attempts": 0
}
